{
  "schema_version": "7.0",
  "artifact_type": "kristall_property_registry",
  "namespace_id": "kristall-main",
  "registry_id": "urn:kristall:registry:properties",
  "properties": [
    {
      "property_id": "KP31",
      "preferred_label": "instance of",
      "description": "Class membership relation.",
      "status": "stable",
      "external_ids": [
        {
          "system": "wikidata",
          "id": "P31",
          "mapping_semantics": "exact"
        },
        {
          "system": "orgo",
          "id": "P31",
          "mapping_semantics": "exact"
        }
      ]
    },
    {
      "property_id": "KP1001",
      "preferred_label": "has legal authority",
      "description": "Relates an actor or institution to an authority it legally possesses in scope.",
      "status": "stable",
      "external_ids": []
    },
    {
      "property_id": "KP1002",
      "preferred_label": "may influence",
      "description": "Structural/informal influence relation; does not imply legal authority or control.",
      "status": "stable",
      "external_ids": []
    }
  ]
}
